{
  "schemaVersion": 1,
  "type": "member",
  "memberId": "r22289hh",
  "displayName": "樊澤熙",
  "class": "5E",
  "groupKey": "fashion",
  "favoriteColor": "",
  "favoriteColorHex": null,
  "hobbies": "ゲーム",
  "hobbyTriggerHtml": "<p>（フォーム回答）</p>",
  "growthHtml": "<p></p>",
  "messageHtml": "<p></p>",
  "htmlPath": "pages/members/r22289hh.html",
  "updatedAt": "2026-09-15T01:26:45+00:00",
  "updatedBy": "system-process-e"
}
