{
  "schemaVersion": 1,
  "type": "member",
  "memberId": "r22321fs",
  "displayName": "福島駿",
  "class": "5A",
  "groupKey": "skate",
  "favoriteColor": "",
  "favoriteColorHex": null,
  "hobbies": "",
  "hobbyTriggerHtml": "<p></p>",
  "growthHtml": "<p></p>",
  "messageHtml": "<p></p>",
  "htmlPath": "pages/members/r22321fs.html",
  "updatedAt": "2026-09-15T01:26:46+00:00",
  "updatedBy": "system-process-e"
}
