{
  "schemaVersion": 1,
  "type": "member",
  "memberId": "r22661kk",
  "displayName": "小林和輝",
  "class": "5A",
  "groupKey": "arch",
  "favoriteColor": "",
  "favoriteColorHex": null,
  "hobbies": "",
  "hobbyTriggerHtml": "<p></p>",
  "growthHtml": "<p></p>",
  "messageHtml": "<p></p>",
  "htmlPath": "pages/members/r22661kk.html",
  "updatedAt": "2026-09-15T00:00:00+09:00",
  "updatedBy": "system-process-b"
}
