{
  "schemaVersion": 1,
  "type": "member",
  "memberId": "r25660na",
  "displayName": "野田彩夏",
  "class": "5D",
  "groupKey": "arch",
  "favoriteColor": "",
  "favoriteColorHex": null,
  "hobbies": "睡眠",
  "hobbyTriggerHtml": "<p>疲労がたまりすぎて寝ると何もかも忘れるから。</p>",
  "growthHtml": "<p></p>",
  "messageHtml": "<p></p>",
  "htmlPath": "pages/members/r25660na.html",
  "updatedAt": "2026-09-15T01:26:49+00:00",
  "updatedBy": "system-process-e"
}
