{
  "schemaVersion": 1,
  "type": "member",
  "memberId": "r22570kr",
  "displayName": "草深りお",
  "class": "5C",
  "groupKey": "fashion",
  "favoriteColor": "",
  "favoriteColorHex": null,
  "hobbies": "ドラマ鑑賞、音楽",
  "hobbyTriggerHtml": "<p></p>",
  "growthHtml": "<p></p>",
  "messageHtml": "<p></p>",
  "htmlPath": "pages/members/r22570kr.html",
  "updatedAt": "2026-09-15T01:26:46+00:00",
  "updatedBy": "system-process-e"
}
