{
  "schemaVersion": 1,
  "type": "member",
  "memberId": "r25173ok",
  "displayName": "奥村京太",
  "class": "5F",
  "groupKey": "skate",
  "favoriteColor": "",
  "favoriteColorHex": null,
  "hobbies": "",
  "hobbyTriggerHtml": "<p></p>",
  "growthHtml": "<p></p>",
  "messageHtml": "<p></p>",
  "htmlPath": "pages/members/r25173ok.html",
  "updatedAt": "2026-09-15T00:00:00+09:00",
  "updatedBy": "system-process-b"
}
